{
 "transition_id": "0001-ltqv_v1-1.0.0-prevalidation.8",
 "strategy_code": "ltqv_v1",
 "lineage": "ltqv",
 "card_sha256": "401660a7d5ccb805c12bdac6cc4ffdbea8413a96ac00cfe4990bde6d02f34546",
 "from_status": "none",
 "to_status": "experimental",
 "decided_by": "claude (r5.5 re-pin, for Harsh to confirm)",
 "decided_at": "2026-09-24T18:00:00+05:30",
 "reason": "Registry 3.0.0 re-pin (audit A2-A4, B7, C3, C9): card version 1.0.0-prevalidation.8 registered as experimental; no sealed holdout result has been seen for any lineage",
 "evidence": {
  "linter_report_sha256": "04a5a6e8f1ef2f088d7da041055bdf5d287051072832d90360b056a29341deab",
  "holdout_exposure_declaration": {
   "derived_from": [],
   "sealed_results_seen": []
  }
 }
}
