{
 "transition_id": "0002-mom_v1-1.0.0-prevalidation.8",
 "strategy_code": "mom_v1",
 "lineage": "mom",
 "card_sha256": "3297a6f01c93f83b0f9f8376b7d1dc98428e24af666a0959437f91369cad3bf5",
 "from_status": "none",
 "to_status": "experimental",
 "decided_by": "claude (r5.5 re-pin, for Harsh to confirm)",
 "decided_at": "2026-09-24T18:00:00+05:30",
 "reason": "Registry 3.0.0 re-pin (audit A2-A4, B7, C3, C9): card version 1.0.0-prevalidation.8 registered as experimental; no sealed holdout result has been seen for any lineage",
 "evidence": {
  "linter_report_sha256": "4b65b6426b9c59e5d2083b92e7fed08cf84d6cba31294a46d4c05850342a52ce",
  "holdout_exposure_declaration": {
   "derived_from": [],
   "sealed_results_seen": []
  }
 }
}
